07:15:43.491495 IP UbuntuCOMP3134.42191 > 10.0.2.3.domain: 33348+ [1au] AAAA? connectivity-check.ubuntu.com. (58)
07:15:43.510509 IP 10.0.2.3.domain > UbuntuCOMP3134.42191: 33348 12/0/1 AAAA 2620:2d:4000:1::2b, AAAA 2620:2d:4000:1::22, AAAA 2001:67c:1562::23, AAAA 2620:2d:4000:1::98, AAAA 2620:2d:4002:1::196, AAAA 2620:2d:4000:1::97, AAAA 2620:2d:4002:1::198, AAAA 2620:2d:4002:1::197, AAAA 2620:2d:4000:1::2a, AAAA 2620:2d:4000:1::96, AAAA 2620:2d:4000:1::23, AAAA 2001:67c:1562::24 (394)
07:15:43.837326 IP UbuntuCOMP3134.50817 > 10.0.2.3.domain: 58471+ [1au] PTR? 3.2.0.10.in-addr.arpa. (50)
07:15:43.851771 IP 10.0.2.3.domain > UbuntuCOMP3134.50817: 58471 NXDomain 0/1/1 (145)
07:15:43.852556 IP UbuntuCOMP3134.36479 > 10.0.2.3.domain: 50858+ [1au] PTR? 15.2.0.10.in-addr.arpa. (51)
07:15:43.857040 IP 10.0.2.3.domain > UbuntuCOMP3134.36479: 50858 NXDomain 0/1/1 (146)
07:16:02.227299 IP UbuntuCOMP3134.58045 > 10.0.2.3.domain: 53804+ [1au] A? connectivity-check.ubuntu.com. (58)
07:16:02.243051 IP 10.0.2.3.domain > UbuntuCOMP3134.58045: 53804 12/0/1 A 185.125.190.97, A 185.125.190.17, A 91.189.91.98, A 91.189.91.97, A 91.189.91.48, A 185.125.190.96, A 91.189.91.96, A 185.125.190.98, A 185.125.190.49, A 91.189.91.49, A 185.125.190.18, A 185.125.190.48 (250)

