07:13:51.827990 IP UbuntuCOMP3134.59288 > 151.101.125.91.https: Flags [P.], seq 4273343151:4273343190, ack 972674755, win 63360, length 39
07:13:51.828559 IP 151.101.125.91.https > UbuntuCOMP3134.59288: Flags [.], ack 39, win 65535, length 0
07:13:51.840658 IP 151.101.125.91.https > UbuntuCOMP3134.59288: Flags [P.], seq 1:40, ack 39, win 65535, length 39
07:13:51.840677 IP UbuntuCOMP3134.59288 > 151.101.125.91.https: Flags [.], ack 40, win 63360, length 0
07:13:52.151877 IP UbuntuCOMP3134.56582 > 10.0.2.3.domain: 57991+ [1au] PTR? 91.125.101.151.in-addr.arpa. (56)
07:13:52.168302 IP 10.0.2.3.domain > UbuntuCOMP3134.56582: 57991 NXDomain 0/1/1 (140)
07:13:52.168695 IP UbuntuCOMP3134.54027 > 10.0.2.3.domain: 49169+ [1au] PTR? 15.2.0.10.in-addr.arpa. (51)
07:13:52.179539 IP 10.0.2.3.domain > UbuntuCOMP3134.54027: 49169 NXDomain 0/1/1 (146)
07:13:53.166152 IP UbuntuCOMP3134.57480 > 10.0.2.3.domain: 10480+ [1au] PTR? 3.2.0.10.in-addr.arpa. (50)
07:13:53.185139 IP 10.0.2.3.domain > UbuntuCOMP3134.57480: 10480 NXDomain 0/1/1 (145)
